id,ts,platform,market_id,title,category,side,entry_price,stake_usd,score,signals,triggers,hours_to_close,mode,status,last_price,resolved_ts,result,roi,clv
1,2026-07-11T12:00:39Z,poly,0x8bf1c1536ecb1c08fe13c6b71e8ab1f58bf3461c4cb79f5f1679f869a06aef86,Will there be no change in Fed interest rates after the July 2026 meeting?,other,yes,0.7900,25,73,"volume spike (22x baseline) + $13,009 single trade (into YES, 834x typical) + out of character (873x this wallet's typical size)",large_trade+volume_spike+within_trader,420.0,calib,open,0.7900,,,,
2,2026-07-11T12:00:39Z,poly,0x60c2c085ee8c16bc8f2419739a94971d4c9d00f637ead10fc0f540afa1be64e8,Strait of Hormuz traffic returns to normal by August 31?,other,no,0.7900,25,73,"volume spike (11x baseline) + $15,795 single trade (against YES, 1779x typical) + out of character (356x this wallet's typical size)",large_trade+volume_spike+within_trader,1212.0,calib,open,0.7900,,,,
3,2026-07-11T12:00:39Z,poly,0xe3829381f51ef07bc79fa71605d413f4b16ff8d0bc491bf0ef587ef65311e582,Will A Nation That Has Never Won the World Cup Win in 2026?,sports,yes,0.0700,25,69,"volume spike (29x baseline) + $7,289 single trade (into YES, 827x typical) + out of character (172x this wallet's typical size)",large_trade+volume_spike+within_trader,208.0,calib,open,0.0700,,,,
4,2026-07-11T12:00:39Z,poly,0x7b52405ad0e0d31bfe970940b67d77f24ecedeab8a2361c11148c02a006e325c,Will Norway win the 2026 FIFA World Cup?,sports,yes,0.0610,25,68,"volume spike (4x baseline) + $4,794 single trade (into YES, 418x typical) + fresh wallet (<3d old) loading up + out of character (51x this wallet's typical size)",fresh_wallet+large_trade+volume_spike+within_trader,204.0,calib,open,0.0610,,,,
5,2026-07-11T12:00:39Z,poly,0xb838caec0354e09985f2c228c54ba190cb284f390beda5ffd58d163ba00648ec,"US x Iran diplomatic meeting by July 31, 2026?",other,no,0.5300,25,66,"volume spike (13x baseline) + price jump -6c in 2.3h + $646 single trade (against YES, 92x typical)",large_trade+price_jump+volume_spike,492.0,calib,open,0.5300,,,,
6,2026-07-11T12:00:39Z,poly,0x125c399641397f7b7cc111f3729999e32154a916deb1161527af031decde1f77,Will France reach the 2026 FIFA World Cup final?,sports,yes,0.6100,25,65,"volume spike (8x baseline) + $13,588 single trade (into YES, 1742x typical)",large_trade+volume_spike,204.0,calib,open,0.6100,,,,
7,2026-07-11T12:00:39Z,poly,0xbdf08297ec6e7c68cf8b24550f5fd2b648095bffa74495c732ce0a31222b1bbb,Will Hanwha Life Esports win MSI 2026?,other,no,0.7000,25,56,volume spike (11x baseline) + price jump -6c in 2.3h,price_jump+volume_spike,40.0,calib,open,0.7000,,,,
8,2026-07-11T12:00:39Z,poly,0x253676d94edd8f3e92060410bec8bca9117890d117d06664d31867db0e396c56,Mojtaba Khamenei seen in public by July 31?,other,yes,0.0600,25,49,"volume spike (17x baseline) + $1,606 single trade (into YES, 338x typical)",large_trade+volume_spike,468.0,calib,open,0.0600,,,,
